{
  "$schema": "../schema/jquery-ui-migration.schema.json",
  "schema": "jqstar-jquery-ui-migration/1",
  "reviewedAt": "2026-09-04T15:30:00Z",
  "sourceMatrix": {
    "path": "quality/jquery-ecosystem.json",
    "sha256": "aa2630146c4a86228e9cb864a47859bc37528ef05d812ac113e14efe55392609"
  },
  "packages": {
    "jquery": {
      "name": "jquery",
      "version": "4.0.0",
      "resolved": "https://registry.npmjs.org/jquery/-/jquery-4.0.0.tgz",
      "integrity": "sha512-TXCHVR3Lb6TZdtw1l3RTLf8RBWVGexdxL6AC8/e0xZKEpBflBsjh9/8LXw+dkNFuOyW9B7iB3O1sP7hS0Kiacg==",
      "shasum": "95c33ac29005ff72ec444c5ba1cf457e61404fbb",
      "role": "peer-and-fixture"
    },
    "jqueryUi": {
      "name": "jquery-ui",
      "version": "1.14.2",
      "resolved": "https://registry.npmjs.org/jquery-ui/-/jquery-ui-1.14.2.tgz",
      "integrity": "sha512-1gSl7PUjyipa2adSr780Ujk16faicrV7PjPPzPtvWk7tTqBnsqp67NNV9jZK2+BIxUPXWSnIUU/LBCgwgGZE+Q==",
      "shasum": "515288b5c730b720acca6e53a0366827ad834053",
      "role": "fixture-only"
    }
  },
  "sources": [
    {
      "id": "openjs.archived-projects",
      "kind": "status",
      "url": "https://github.com/openjs-foundation/cross-project-council",
      "reviewedAt": "2026-09-04T15:30:00Z"
    },
    {
      "id": "jquery-ui.release-1.14.2",
      "kind": "release",
      "url": "https://blog.jqueryui.com/2026/01/jquery-ui-1-14-2-released/",
      "reviewedAt": "2026-09-04T15:30:00Z"
    },
    {
      "id": "jquery-ui.api-1.14",
      "kind": "catalog",
      "url": "https://api.jqueryui.com/",
      "reviewedAt": "2026-09-04T15:30:00Z"
    },
    {
      "id": "jquery.release-4.0.0",
      "kind": "release",
      "url": "https://blog.jquery.com/2026/01/17/jquery-4-0-0/",
      "reviewedAt": "2026-09-04T15:30:00Z"
    },
    {
      "id": "jquery.support",
      "kind": "support",
      "url": "https://jquery.com/support/",
      "reviewedAt": "2026-09-04T15:30:00Z"
    },
    {
      "id": "jquery-ui.upgrade-1.14",
      "kind": "migration",
      "url": "https://jqueryui.com/upgrade-guide/1.14/",
      "reviewedAt": "2026-09-04T15:30:00Z"
    },
    {
      "id": "jquery-migrate.workflow",
      "kind": "migration",
      "url": "https://github.com/jquery/jquery-migrate/blob/main/README.md",
      "reviewedAt": "2026-09-04T15:30:00Z"
    },
    {
      "id": "jquery-ui.themeroller",
      "kind": "theme",
      "url": "https://jqueryui.com/themeroller/",
      "reviewedAt": "2026-09-04T15:30:00Z"
    }
  ],
  "migrationClasses": [
    "direct-semantic",
    "changed-contract",
    "external-coexistence",
    "no-equivalent"
  ],
  "officialInventory": [
    {
      "id": "jquery-ui.widget.accordion",
      "category": "widget",
      "name": "Accordion",
      "url": "https://api.jqueryui.com/accordion/",
      "matrixId": "migration.widget.accordion"
    },
    {
      "id": "jquery-ui.widget.autocomplete",
      "category": "widget",
      "name": "Autocomplete",
      "url": "https://api.jqueryui.com/autocomplete/",
      "matrixId": "migration.widget.autocomplete"
    },
    {
      "id": "jquery-ui.widget.button",
      "category": "widget",
      "name": "Button",
      "url": "https://api.jqueryui.com/button/",
      "matrixId": "migration.widget.button"
    },
    {
      "id": "jquery-ui.widget.buttonset",
      "category": "widget",
      "name": "Buttonset",
      "url": "https://api.jqueryui.com/buttonset/",
      "matrixId": "migration.widget.buttonset"
    },
    {
      "id": "jquery-ui.widget.checkboxradio",
      "category": "widget",
      "name": "Checkboxradio",
      "url": "https://api.jqueryui.com/checkboxradio/",
      "matrixId": "migration.widget.checkboxradio"
    },
    {
      "id": "jquery-ui.widget.controlgroup",
      "category": "widget",
      "name": "Controlgroup",
      "url": "https://api.jqueryui.com/controlgroup/",
      "matrixId": "migration.widget.controlgroup"
    },
    {
      "id": "jquery-ui.widget.datepicker",
      "category": "widget",
      "name": "Datepicker",
      "url": "https://api.jqueryui.com/datepicker/",
      "matrixId": "migration.widget.datepicker"
    },
    {
      "id": "jquery-ui.widget.dialog",
      "category": "widget",
      "name": "Dialog",
      "url": "https://api.jqueryui.com/dialog/",
      "matrixId": "migration.widget.dialog"
    },
    {
      "id": "jquery-ui.widget.menu",
      "category": "widget",
      "name": "Menu",
      "url": "https://api.jqueryui.com/menu/",
      "matrixId": "migration.widget.menu"
    },
    {
      "id": "jquery-ui.widget.progressbar",
      "category": "widget",
      "name": "Progressbar",
      "url": "https://api.jqueryui.com/progressbar/",
      "matrixId": "migration.widget.progressbar"
    },
    {
      "id": "jquery-ui.widget.selectmenu",
      "category": "widget",
      "name": "Selectmenu",
      "url": "https://api.jqueryui.com/selectmenu/",
      "matrixId": "migration.widget.selectmenu"
    },
    {
      "id": "jquery-ui.widget.slider",
      "category": "widget",
      "name": "Slider",
      "url": "https://api.jqueryui.com/slider/",
      "matrixId": "migration.widget.slider"
    },
    {
      "id": "jquery-ui.widget.spinner",
      "category": "widget",
      "name": "Spinner",
      "url": "https://api.jqueryui.com/spinner/",
      "matrixId": "migration.widget.spinner"
    },
    {
      "id": "jquery-ui.widget.tabs",
      "category": "widget",
      "name": "Tabs",
      "url": "https://api.jqueryui.com/tabs/",
      "matrixId": "migration.widget.tabs"
    },
    {
      "id": "jquery-ui.widget.tooltip",
      "category": "widget",
      "name": "Tooltip",
      "url": "https://api.jqueryui.com/tooltip/",
      "matrixId": "migration.widget.tooltip"
    },
    {
      "id": "jquery-ui.interaction.draggable",
      "category": "interaction",
      "name": "Draggable",
      "url": "https://api.jqueryui.com/draggable/",
      "matrixId": "migration.interaction.draggable"
    },
    {
      "id": "jquery-ui.interaction.droppable",
      "category": "interaction",
      "name": "Droppable",
      "url": "https://api.jqueryui.com/droppable/",
      "matrixId": "migration.interaction.droppable"
    },
    {
      "id": "jquery-ui.interaction.mouse",
      "category": "interaction",
      "name": "Mouse",
      "url": "https://api.jqueryui.com/mouse/",
      "matrixId": "migration.interaction.mouse"
    },
    {
      "id": "jquery-ui.interaction.resizable",
      "category": "interaction",
      "name": "Resizable",
      "url": "https://api.jqueryui.com/resizable/",
      "matrixId": "migration.interaction.resizable"
    },
    {
      "id": "jquery-ui.interaction.selectable",
      "category": "interaction",
      "name": "Selectable",
      "url": "https://api.jqueryui.com/selectable/",
      "matrixId": "migration.interaction.selectable"
    },
    {
      "id": "jquery-ui.interaction.sortable",
      "category": "interaction",
      "name": "Sortable",
      "url": "https://api.jqueryui.com/sortable/",
      "matrixId": "migration.interaction.sortable"
    },
    {
      "id": "jquery-ui.effect.add-class",
      "category": "effect",
      "name": ".addClass()",
      "url": "https://api.jqueryui.com/addClass/",
      "matrixId": "migration.effects.class-animation"
    },
    {
      "id": "jquery-ui.effect.blind",
      "category": "effect",
      "name": "Blind",
      "url": "https://api.jqueryui.com/blind-effect/",
      "matrixId": "migration.effects.catalog"
    },
    {
      "id": "jquery-ui.effect.bounce",
      "category": "effect",
      "name": "Bounce",
      "url": "https://api.jqueryui.com/bounce-effect/",
      "matrixId": "migration.effects.catalog"
    },
    {
      "id": "jquery-ui.effect.clip",
      "category": "effect",
      "name": "Clip",
      "url": "https://api.jqueryui.com/clip-effect/",
      "matrixId": "migration.effects.catalog"
    },
    {
      "id": "jquery-ui.effect.color-animation",
      "category": "effect",
      "name": "Color Animation",
      "url": "https://api.jqueryui.com/color-animation/",
      "matrixId": "migration.effects.class-animation"
    },
    {
      "id": "jquery-ui.effect.css-clip",
      "category": "effect",
      "name": ".cssClip()",
      "url": "https://api.jqueryui.com/cssClip/",
      "matrixId": "migration.effects.internal-utilities"
    },
    {
      "id": "jquery-ui.effect.drop",
      "category": "effect",
      "name": "Drop",
      "url": "https://api.jqueryui.com/drop-effect/",
      "matrixId": "migration.effects.catalog"
    },
    {
      "id": "jquery-ui.effect.easings",
      "category": "effect",
      "name": "Easings",
      "url": "https://api.jqueryui.com/easings/",
      "matrixId": "migration.effects.internal-utilities"
    },
    {
      "id": "jquery-ui.effect.effect-method",
      "category": "effect",
      "name": ".effect()",
      "url": "https://api.jqueryui.com/effect/",
      "matrixId": "migration.effects.visibility-methods"
    },
    {
      "id": "jquery-ui.effect.explode",
      "category": "effect",
      "name": "Explode",
      "url": "https://api.jqueryui.com/explode-effect/",
      "matrixId": "migration.effects.catalog"
    },
    {
      "id": "jquery-ui.effect.fade",
      "category": "effect",
      "name": "Fade",
      "url": "https://api.jqueryui.com/fade-effect/",
      "matrixId": "migration.effects.catalog"
    },
    {
      "id": "jquery-ui.effect.fold",
      "category": "effect",
      "name": "Fold",
      "url": "https://api.jqueryui.com/fold-effect/",
      "matrixId": "migration.effects.catalog"
    },
    {
      "id": "jquery-ui.effect.hide",
      "category": "effect",
      "name": ".hide()",
      "url": "https://api.jqueryui.com/hide/",
      "matrixId": "migration.effects.visibility-methods"
    },
    {
      "id": "jquery-ui.effect.highlight",
      "category": "effect",
      "name": "Highlight",
      "url": "https://api.jqueryui.com/highlight-effect/",
      "matrixId": "migration.effects.catalog"